{"accepted_at":"2026-10-15T12:00:01Z","capture_id":"66666666-6666-4666-8666-666666666666","operation_id":"55555555-5555-4555-8555-555555555555","organiser_item_id":"44444444-4444-4444-8444-444444444444","payload_sha256":"459b6077486030d3943d797dd9c2f3786b53755119adf81e6412a91bccae067e","schema_version":1,"workspace_id":"11111111-1111-4111-8111-111111111111"}